Question,A,B,C,D,Correct,Explanation,Finance,Assessment,Difficulty
"Sheree, who owns a popular family-style restaurant, recently asked her attorney to prepare a document to protect her famous chicken noodle soup recipe. Sheree signed the document containing the recipe and had it notarized. This document is designed to protect Sheree's",copyright.,trade secret.,trademark.,patent.,B,"Trade secret. A trade secret is undisclosed information within a particular business or industry that typically gives the business a competitive advantage. Sheree's famous chicken noodle soup, for instance, is likely a reason for her restaurant's popularity. If Sheree's competitors were to gain access to her recipe and begin serving her chicken noodle soup at their restaurants, Sheree's business would likely giving their creators sole rights to them for a certain period of years. A trademark is a symbol, design, or word used by a producer to identify a good or service and registered with the government to prevent use by others. A patent is legal protection of an invention or process. https://www.entrepreneur.com/encyclopedia/intellectual-property",Business Law,1,hard
"What is typically the most significant role of a compliance officer in a bank, investment company, or insurance company?",To ensure that the company is following financial laws,To enforce the business's code of conduct,To educate employees on industry ethics,To ensure employees follow company policies and procedures,A,"To ensure that the company is following financial laws. Compliance officers in the financial services industry are typically responsible for ensuring that their company is following financial laws and external regulations. A compliance officer may play a role in enforcing a business's code of conduct, educating employees on industry ethics, and/or ensuring that employees follow company policies and procedures, but these responsibilities are secondary. The primary role is ensuring that the business complies with financial laws and regulations. 2020, from https://www.int-comp.org/careers/your-career-in-compliance/what-is-compliance/",Business Law,1,medium
An annual audit is an example of a(n) __________ internal control.,corrective,detective,reconciliation,preventative,B,"Detective. Businesses use a variety of internal accounting controls to ensure the reliability of accounting systems and compliance with financial laws and regulations. Detective controls such as annual audits are meant to help identify existing financial problems. Preventive controls are designed to prevent errors or fraud from happening. Corrective controls are intended to correct errors after they are identified. Reconciliation is a comparison of a business's internal accounting records to external records of some kind. 3, 2020, from https://bizfluent.com/info-8046701-types-internal-controls.html",Business Law,1,medium
Which of the following is a benefit of using artificial intelligence in compliance:,Increases costs,Increases false positives,Reduces human error,Reduces efficiency,C,"Reduces human error. Compliance officers can benefit from artificial intelligence (AI) in a number of ways. AI technology helps increase the efficiency and effectiveness of the compliance function, lowers the chance for human error, and decreases false positives in the system. While adopting artificial intelligence can be costly at first, companies can save money long-term as AI reduces the human capital required to carry out compliances processes and procedures. Retrieved February 3, 2020, from https://a-teaminsight.com/three-ways-artificial-intelligenceimproves-compliance/?brand=rti",Business Law,1,medium
Mooreshead Bank has placed a claim on Marc's property to protect Mooreshead from financial loss if Marc is unable to pay back his bank loan. Mooreshead has secured a __________ against Marc's property.,license,lien,label,ledger,B,Lien. A lien is a legal claim to an item of property that protects the seller if the buyer does not complete his/her payments. Liens are designed to protect creditors from financial loss. A license is a permit that allows a business to operate. A label is printed information affixed to a consumer good. A ledger is the accounting record for a specific department or area of a business. https://www.upcounsel.com/debtor-and-creditor-in-contract-law,Business Law,1,hard
"Charlotte, an investment advisor, does more than simply sell stocks and bonds. She also provides investing advice to her clients on an ongoing basis. She talks with clients about their short-term and longterm investing goals and helps them select the investments that are best for them. Charlotte acts as her clients'",credit analyst.,accountant.,fiduciary.,institutional investor.,C,"Fiduciary. A fiduciary is someone who acts on behalf of another person or organization. In most cases, fiduciaries are responsible for managing their clients' financial assets and making decisions in the best interest of their clients. Because Charlotte does more than simply sell investments to her clients, she is considered a fiduciary. An accountant gathers, records, organizes, and reports financial data. A credit analyst assesses the requests of individuals and businesses applying for loans, makes reports to the loan committee, and helps decide if the requests should be granted. Institutional investors are mutual fund managers, large investment firms, and significant holding companies who invest in the stock market. https://www.investopedia.com/terms/f/fiduciary.asp",Business Law,1,hard
Robert has learned that his company will announce a round of layoffs in two weeks. Robert decides to sell some of the stock options he had in the company before the news of the layoffs goes public. He tells his friends to do the same. This is an example of,extortion.,corporate espionage.,corporate fraud.,insider trading.,D,"Insider trading. Insider trading occurs when a company's owners, directors, or key management trade its stock. Insider trading is illegal when those individuals make trades based on information that has not been disclosed to the public. Corporate fraud involves deception purposely carried out so that a company can secure an unfair or unlawful gain. Corporate espionage involves spying on a competitor and/or theft of a competitor's proprietary information. Extortion involves using force to obtain another person's or company's property or money. https://www.investopedia.com/terms/i/insidertrading.asp",Business Law,1,hard
Raheem recently sold an investment that he had owned for five years. He sold the investment for considerably more money than he had spent on it originally. Raheem is likely to owe __________ tax on the profit that he made from the sale of the investment.,income,long-term capital gains,short-term capital gains,excise,B,"Long-term capital gains. Capital gains are earnings from the appreciation of an investment. When an investor sells his/her investment for more money than what s/he spent on it originally, the investor is likely to owe capital gains tax. Investors pay long-term capital gains tax if they owned the asset for more than a year. If investors owned the asset for a year or less, they are likely to owe short-term capital gains tax. Income tax is a tax levied on an individual's or business's earnings. Excise taxes are indirect taxes charged on specific goods such as gasoline and alcohol. https://www.investopedia.com/terms/c/capital_gains_tax.asp",Business Law,1,hard
What is a benefit of having established policies for taking breaks and requesting time off?,Less confusion among employees,More power for management,More open door policies,Fewer government incentives,A,"Less confusion among employees. Businesses use established policies and procedures to set clear expectations for employee conduct. Employees who have a clear understanding of how and when to take breaks or request time off, for instance, are likely to be more productive. Although some policies and procedures give power to managers, established policies for taking breaks and requesting time off don't necessarily do so. An open door policy is a business practice whereby management encourages communication between employees and their superiors; however, open door policies are typically unrelated to policies for taking breaks and requesting time off. An incentive is something that motivates or encourages someone to behave a certain way. Government incentives are unrelated to policies for taking breaks and requesting time off. from https://smallbusiness.chron.com/personnel-policies-procedures-1234.html",Communication Skills,1,medium
Which of the following is a good way to end a business phone call:,Offer your email address if the caller needs additional information.,List all of the points made in the call.,Make small talk about the caller's day.,Wait for the caller to speak before deciding the call is over.,A,"Offer your email address if the caller needs additional information. By providing your email address, you create another line of communication for the caller in case s/he needs additional information. Providing your email address is also a good way to indicate that you would like to end the call without being abrupt. While summarizing the key points made in the call can be helpful, it is unnecessary to list every point made. You are more likely to make small talk about a caller's day at the beginning of a call versus at the end. Waiting for the caller to speak can cause confusion, especially if you are leading the call. 2020, from https://www.thebalancesmb.com/end-phone-calls-professionally-2533712",Communication Skills,1,easy
What should be included early in a written report?,A description of the research method and findings,A broad sentence detailing numerous arguments,A listing of the printed and online sources cited in the report,A specific sentence that highlights the main idea of the report,D,"A specific sentence that highlights the main idea of the report. The introduction to a written report should include a specific sentence detailing the main idea or purpose of the report. Arguments for and against the main idea should be included in the body of the report. Sources should also be cited in the body of the report as information from the different sources is introduced. The research method and findings should be included throughout the report, rather than right at the beginning. January 13, 2020, from https://custom-writing.org/blog/report-writing-top-tips",Communication Skills,2,easy
A video conference call is a __________ channel of communication.,lean,rich,slight,detailed,B,"Rich. A rich channel of communication involves multiple senses such as sight and hearing. A video conference call is an example of a rich communication channel because it includes seeing other participants' faces and hearing what others are saying. A lean channel of communication generally only uses sight. Slight and detailed channels of communication are not generally recognized terms. 2020, from https://www.encyclopedia.com/finance/finance-and-accountingmagazines/communication-channels",Communication Skills,2,medium
A magazine advertisement is an example of,word-of-mouth marketing.,publicity.,a touchpoint.,a brand promise.,C,"A touchpoint. A touchpoint is any interaction between a business and a customer or potential customer. The sum of the touchpoints that a customer experiences becomes the company's communication of its brand promise to that customer. Advertisements, publicity (unsponsored mentions of the brand or business in the news), and word-of-mouth marketing (what other customers are saying) are all examples of touchpoints that occur before a customer does business with a company. A brand promise is the specific benefit that customers can expect from using the good/service and interacting with the company.",Customer Relations,2,easy
Which of the following forms of customer management is most likely to look outward and have a customer-centric focus:,Customer relationship management,Customer experience management,Structured customer management,Inverse customer management,B,"Customer experience management. Customer experience management (CEM) includes the strategies, processes, and policies a business uses to meet or exceed customer expectations and to provide customers with outstanding experiences at every touchpoint. CEM looks outward, focuses on customer needs and wants, and uses touchpoints to allow the customer to learn something valuable about the company. Customer relationship management (CRM) includes the strategies, processes, technology, and people that a business uses to build, maintain, and maximize the long-term value of customer relationships. CRM tends to look inward, focuses on the business itself, and uses touchpoints to learn something valuable about the customer. Structured customer management and inverse customer management are not types of customer management. Structured relationships are characterized by rules, well-defined positions, and clear lines of authority. Inverse relationships exist when one value in a pair increases when the other decreases.",Customer Relations,2,medium
What is the primary role of financial planners?,To ensure businesses are compliant with government regulation,To make the most money for their own firms,To trade with other planners in the stock market,To help clients make wise investments and prepare for the future,D,"To help clients make wise investments and prepare for the future. Generally, financial planners help their clients make smart financial choices. More specifically, they assist clients in making wise investments and help clients prepare for the future financially. They also need to make money for their firms, but the client should come first. Financial planners assist clients in buying and selling stocks, but they don't purposefully trade with other planners in the stock market. Financial planners have different responsibilities than compliance agents who are responsible for ensuring that businesses are compliant with government regulations. 17, 2020, from https://www.investopedia.com/articles/basics/07/financial-advice.asp",Customer Relations,2,easy
What is the primary purpose of customer-relationship management technology?,To compile a mass email list,To make phone calls to keep customers interested,To archive past sales only,To establish stronger connections with customers,D,"To establish stronger connections with customers. Customer relationship management (CRM) incorporates the strategies, processes, technology, and people a business uses to build, maintain, and maximize the long-term value of customer relationships. CRM technology provides businesses with information about their customers and helps those businesses establish better relationships with top customers. Although businesses can use CRM technology to make phone calls to customers, archive past sales, and compile mass email lists, those are not the primary purpose of CRM technology. Learning Inc.",Customer Relations,2,medium
Businesses use marginal analysis for the purpose of,maximizing profit.,increasing productivity.,eliminating mistakes.,maintaining reputation.,A,"Maximizing profit. Marginal analysis is an assessment of the potential benefits of a business activity compared to the costs incurred from that same activity. Businesses use marginal analysis to make decisions and maximize profit. Marginal analysis is not directly related to increasing productivity, eliminating mistakes, or maintaining an organization's reputation. https://www.investopedia.com/terms/m/marginal-analysis.asp",Financial Analysis,2,easy
"Valerie used to wait all year for her family's trip to the beach, where she bought saltwater taffy and homemade fudge. Now, she can order the sweets online and have them whenever she wants. This is an example of how",utility is constant and unchanging.,place utility is not important.,business can create form utility.,the Internet has changed utility.,D,"The Internet has changed utility. The Internet impacts utility in many ways. One of these is by making it easier for products to have place utility. Online ordering means that customers can get the products they want regardless of their physical distance from the business, as is the case with Valerie and her sweets. This example does not demonstrate that place utility is not important; rather, the use of the Internet has enhanced place utility. This example is not related to form utility. Finally, this example does not demonstrate that utility is constant and unchanging.",Economics,2,hard
"A company moves its manufacturing facilities to another country, where it is able to pay employees much less money. Many people see this action as unethical, but what reason might the company use to defend itself?",The action is acceptable in a foreign culture.,The action is committed by unethical employees.,The action is beneficial for employees.,The action results in a negative public image.,A,"The action is acceptable in a foreign culture. What many Americans would consider unethical may be perfectly acceptable in another culture. A major example of this deals with working conditions and wages. In many developing countries, manufacturing standards and pay expectations are much lower than they are in more developed parts of the world. Because of this, some American companies move their operations overseas in an effort to cut costs. These companies are able to pay foreign workers a fraction of the wages they were paying American workers for doing the same work. The company may assume that since its actions are acceptable in the other culture, they are ethical. However, many others may disagree. The company would not say that the action is committed by unethical employees, since that would involve admitting wrongdoing. The action is likely not beneficial for employees. The action could result in a negative public image, but this is not a reason the company can use to defend itself.",Economics,2,hard
A company's board of directors is often responsible for __________ and __________ the top executives.,encouraging; shadowing,supporting; assessing,replacing; auditing,promoting; networking,B,"Supporting; assessing. The board of directors is responsible for helping an organization reach its goals while meeting stakeholder needs. This often includes hiring, supporting, and assessing the performance of the organization's top executives. The board of directors does not usually shadow or audit the top executives. While it's possible for members of a board of directors to encourage, promote, and make networking connections for top executives, those are not necessarily responsibilities of the board. from https://www.investopedia.com/terms/b/boardofdirectors.asp",Professional Development,2,hard
"In the 1970s, OPEC (Organization of the Petroleum-Exporting Countries) increased the price of oil as a form of political protest against the United States. This pushed up the costs of many goods and services in the United States. This is an example of",cost-push inflation.,demand-pull deflation.,cost-push deflation.,demand-pull inflation.,A,"Cost-push inflation. Inflation can occur when certain commodities become more limited and more expensive, driving up the prices of all related goods and services. This is called cost-push inflation. When OPEC increased the price of oil in the 1970s, the result was an increase in the cost of several other goods and services. This was an example of cost-push inflation. Demand-pull inflation is a different type of inflation in which demand is greater than supply, ""pulling"" inflation higher. Deflation is a steady decline in the general price levels of goods and services over time. There is no such thing as demand-pull deflation or cost-push deflation.",Economics,3,hard
The biggest traders of currency on the foreign exchange market are,individual traders.,commercial and investment banks.,investment funds.,businesses and corporations.,B,"Commercial and investment banks. Banks are the biggest traders of currency on the foreign exchange market, making up about half of its trading volume. They often trade with each other exclusively on their own interbank market, a series of electronic networks used only by commercial banking institutions. Banks may use the forex to make transactions for clients or to engage in speculative trading for their own profit. Investment funds are the second biggest traders of currency on the foreign exchange market. Investment funds use the forex to exchange currency when buying or selling foreign securities and to engage in speculative trading on behalf of their clients. Businesses and corporations also participate in the forex. Companies that buy foreign goods and/or sell their goods in foreign markets participate in the forex as a means to complete these business transactions. Individual traders represent the lowest volume of trading on the foreign exchange market, but the practice of speculative trading for personal profit is quickly gaining popularity.",Economics,3,easy
Jackson is sure that no one will notice if he steals merchandise from his employer. Jackson is facing an ethical dilemma because of,a bad role model.,a lack of consequences.,pressure from others.,a desire to prove himself.,B,"A lack of consequences. The threat of punishment is one reason why most people behave properly. If Jackson knows that he will not be caught, he may be tempted to steal merchandise from his employer. Jackson is not dealing with a bad role model, pressure from others, or a desire to prove himself.",Emotional Intelligence,3,medium
Which of the following strategies can help you develop cultural sensitivity in the workplace:,Reading about different cultures,Pretending cultural differences do not exist,Asking everyone to dress the same,Joking about every culture equally,A,"Reading about different cultures. One of the best strategies for acquiring cultural sensitivity is to educate yourself about other cultures. This can be achieved by politely asking a person about their culture, educating yourself through reading or attending cultural events, or attending diversity training workshops. Ignoring cultural differences or pretending they do not exist can have the opposite effect from displaying cultural sensitivity. Rather than asking everyone in the workplace to dress the same, a culturally sensitive workplace would allow each employee to wear his/her culture's garb if s/he desires to do so. Joking about a person's culture does not lead to cultural sensitivity; even if you only joke about your own culture, you may not realize how those jokes can affect others.",Emotional Intelligence,3,medium
Which of the following is an advantage of transparent communication in the workplace:,Increased information security,Increased worker productivity,Increased employee turnover,Increased manager turnover,B,"Increased worker productivity. When people are able to communicate more openly with each other, they will be more productive. Businesses that encourage transparency allow employees to ask questions when they are confused or struggling, which can lead to less wasted time. Transparency also leads to fewer misunderstandings, which can create a more productive work environment. Honesty and transparency should not affect an organization's information security. Being transparent does not mean sharing private or restricted information. Both employee and manager turnover are more likely to be decreased in a transparent work environment than increased. This is because transparency leads to trust among coworkers and between employees and managers. If a person trusts the people s/he works with and for, s/he is less likely to want to change jobs, which results in less turnover, not more.",Emotional Intelligence,3,medium
Which of the following is an effective approach to negotiation:,Be willing to adjust your strategy based on the other side's approach.,Do not have a specific goal or target in mind.,Display strong emotional reactions.,Try to trick the other side with carefully chosen language.,A,"Be willing to adjust your strategy based on the other side's approach. Because people and situations differ, you need to be aware of the other side's negotiating tactics and respond appropriately. You might need to change your strategy during the negotiation process. As long as you have established clear objectives ahead of time, you can adjust your strategy and still negotiate effectively. If you do not have a specific goal or target in mind, it will likely be very difficult to know if you have accomplished what you wanted out of a negotiation. It is always important to keep your emotions out of a negotiation. An outburst could easily derail the conversation and hurt your credibility. Any attempts to â€œtrickâ€ the other side could also affect your credibility, which is one of the most important factors in a negotiation. If the other side does not consider you to be credible or trustworthy, it can be very difficult to have a successful negotiation.",Emotional Intelligence,3,easy
