Question,A,B,C,D,Correct,Explanation,Finance,Assessment,Difficulty
Budgets are important to the management process because they,help determine roles and responsibilities.,shift focus from future events to daily issues.,ensure that organizational goals come before personal goals.,remove the possibility of financial constraints.,A,"Help determine roles and responsibilities. Budgets can be used to determine employees' responsibilities and measure performance so that resources are used wisely. Budgets do not shift the focus from future events to daily issues; in fact, they encourage organizations to focus on both the big and small pictures. Budgets also do not necessarily put the focus on organizational goals over personal goals; rather, they try to allow both sets of goals to align. Finally, budgets do not remove the possibility of financial constraints altogether, but they allow organizations to recognize constraints before they become problematic. https://www.principlesofaccounting.com/chapter-21/budgets/",Financial Analysis,6,easy
"A company buys a new water cooler. In the company budget, it divides the cost of the water cooler between the departments that use it. This is known as cost",combination.,divination.,allocation.,activation.,C,"Allocation. In cost allocation, a cost is divided between several cost objects. In this example, a company allocates the cost of a new water cooler to several different departments. This is not considered cost divination, combination, or activation. http://www.accountingcoach.com/blog/what-is-cost-allocation",Financial Analysis,6,hard
"Julie's grandparents have offered to give her a $1,000 gift at either the beginning or end of college. Why should she take the gift at the beginning of college?",She will pay fewer taxes before she begins college.,Inflation will increase the value over time.,She can start earning interest sooner.,She shouldn't; she should wait until after college.,C,"She can start earning interest sooner. If Julie were to wait until after college to accept the gift, she would miss out on four years of interest payments that she could be earning. Therefore, she should accept the gift as soon as possible so that she can maximize her interest returns. Inflation does not increase the value of money over time; rather, it decreases the value. Julie will not necessarily pay fewer taxes on the gift before she begins college; taxes are dependent on many other factors. 2020, from http://www.investopedia.com/articles/03/082703.asp",Financial Analysis,6,hard
Which of the following statements regarding the financial-information management function is true:,Data in a financial-information management system are typically at least four-to-six months old.,"The financial-information management function is an electronic, web-based activity.",The financial-information management function's responsibilities have declined in recent years.,A financial-information management system can be used to support operations management decisions.,D,"A financial-information management system can be used to support operations management decisions. Operations managers might use a financial-information management system to determine operating efficiency, manage inventory, or evaluate key suppliers. Although technology is an integral part of financial-information management function, it is not the only part. The financial-information management function involves people, processes, and equipment/technology. Due to increased compliance requirements, the financial-information management function's responsibilities have increased in recent years. Much more data must be maintained by the financial-information management system for longer periods of time as a result of new laws and regulations. Data in a financial-information management system should be current. In many situations, decision makers need to know what is happening right now, not what happened months or even years ago. information system? Retrieved July 10, 2020, from https://smallbusiness.chron.com/benefitsfinancial-management-information-system-71943.html",Financial Management,6,hard
"To protect the integrity of archived financial information, businesses might consider using different types of",storage strategies.,service procedures.,monetary exchanges.,production methods.,A,"Storage strategies. Businesses are legally required to keep certain types of financial information for a specific period of time. Because many businesses must keep a large amount of financial information, they must consider how to archive, or store, historic information. Businesses often store information on magnetic or optical tapes and disks or a combination of different methods. Because technology is evolving, the types of storage options change, so businesses must keep up with the technology. It is important to keep up with technology because businesses must be able to retrieve archived records in formats that are readable and usable at any given time. Service procedures, monetary exchanges, and production methods will not protect the integrity of archived financial information. https://www.finance.ucla.edu/corporate-accounting/principles-of-data-integrity",Financial Management,6,medium
What is a benefit to businesses of using a central data repository for financial information?,Reliance on historical data,Quick response to complex queries,Focus on low volumes of data,Reliance on a single software application,B,"Quick response to complex queries. A central data repository is a centralized database that businesses use to maintain, update, and store large amounts of financial data throughout their organizations. The benefits to businesses of using a central data repository include quick response to complex queries, accessibility to consistent data, economies of scale, and accessibility by several different software applications. A central data repository contains both current and historical data. from https://www.teleoinc.com/benefits-of-a-central-datarepository/#:~:text=A%20central%20repository%20offers%20trustworthy,as%20standardized %20across%20departmental%20databases.&text=Data%20integration%20and%20collabora tion%20also%20reduces%20and%20in%20most%20cases%20eliminates%20redundancies.",Financial Management,7,hard
"Tara knows that for her small business to grow, she must increase her cash flow. She's unsure, though, whether she should take out a loan or a line of credit. Which of the following budgeting software tools could Tara use to assess the potential impact of each source of funding on her business:",Decision trees,Debt modeling,Environmental scanning,Zero-based modeling,B,"Debt modeling. Some budgeting software applications include a debt modeling tool which allows the user to assess the potential impact of loans and lines of credit. To use the debt modeling tool, the user would input the terms of the loan or line of credit, including the interest rate, term, principal, etc. Decision trees are a data-mining technique commonly used to classify data and build models. Environmental scanning involves gathering information about the environment surrounding a business, analyzing that information, and determining the future impact of that information on the business. Zero-based modeling is a method of budgeting that requires a manager to demonstrate the need for every expense instead of relying on figures from a previous period. https://corporatefinanceinstitute.com/resources/questions/model-questions/financialmodeling-debt/",Financial Management,7,hard
"To determine the bills that are due in the next 10 days and the dollar amount of each bill, a company needs to use a financial analysis application to evaluate its",accounts payable.,dividend payments.,sales revenue.,credit rating.,A,Accounts payable. Accounts payable are the monies owed by the business to others. Accounts-payable applications help businesses organize bills and allocate funds to pay bills when they are due. Budgeting tools and sales applications can help a business analyze its sales revenue. Dividends are payments made to stockholders for their investments. A credit rating is the score assigned to a borrower based on previous loans. http://www.investopedia.com/terms/a/accountspayable.asp,Financial Management,7,hard
What is the relationship between financial information and lean-focused organizations?,Studying lean organizations provides financial information.,Lean organizations have less need for financial information.,Financial information provides ways to reduce wasted resources.,Financial information helps organizations reduce errors.,C,"Financial information provides ways to reduce wasted resources. Lean organizations are those that are focused on maximizing customer value while minimizing waste. Financial information can highlight areas where spending is excessive and can be reduced, for example. Lean organizations do not have less need for financial information. Studying lean organizations does not necessarily provide financial information. Finally, financial information might help organizations reduce errors, but reducing errors is not necessarily the focus of lean organizations. reporting, activity-based costing [ABC], six sigma) https://www.lean.org/WhatsLean/",Financial Management,7,hard
Financial information that a credit card issuer analyzes when reviewing customers' credit card applications include the customers',payment history and current level of debt.,income and preferred standard of living.,employment status and financial goals.,loan balances and consumption rates.,A,"Payment history and current level of debt. Because offering credit is a risk to businesses, they must evaluate many factors to determine the likelihood that a customer will pay credit balances when they are due. Credit card issuers may review the applicant's credit report, which provides details about the customer's payment history of other loans and bills. Another factor analyzed is the applicant's current level of debt, which might include current loan balances with other institutions. Also reviewed is the applicant's employment status and income level, which reveals the applicant's ability to cover his/her debts. The applicant's financial goals, consumption rates, and preferred standard of living are not primary factors that influence an institution's decision to offer credit. from http://www.credit.com/credit-scores/what-is-a-bad-credit-score/",Financial Management,7,hard
"Julia, an HR director, hires a new employee at her company. Which of the following actions should Julia take to orient the new employee:",Allow the employee to get straight to work and run through the rules later,"Focus on job duties and procedures, not getting to know coworkers",Assign a mentor or â€œbuddyâ€ to help the new employee learn the ropes,Encourage the employee to talk about his/her religious and political views,C,"Assign a mentor or â€œbuddyâ€ to help the new employee learn the ropes. An experienced employee can become a mentor for a new employee. This person can answer questions that the new employee has and give her/him a built-in personal connection at the company. Orientation should not just focus on job duties and proceduresâ€”it's also important to touch on the more personal aspects of the job, such as getting to know coworkers and supervisors. Employees should learn the rules and regulations of the company before they dive into work; otherwise, they may make mistakes that could cost the business time and money. Julia shouldn't encourage the new employee to talk about his/her religious or political views at work. This is unprofessional. Retrieved July 10, 2020, from https://smallbusiness.chron.com/importance-new-employeeorientation-human-resources-10242.html",Human Resources Management,7,medium
Becoming more socially minded in marketing can bring a business,more products.,lower costs.,higher profits.,a competitive advantage.,D,"A competitive advantage. Since many consumers are interested in socially responsible products, being socially minded can give a business a competitive advantage over companies who are not practicing socially responsible marketing. Socially minded marketing does not necessarily lead to lower costs, higher profits, or more products.",Marketing,7,easy
"Many businesses provide detailed privacy policies to their customers that explain the safeguards the company has taken to protect the customers' sensitive information. For example, a privacy policy may state that the business will not share a customer's personal information with anyone unless they are given direct permission by the customer. This is an example of a legal issue associated with",the company's public relations.,federal government security.,customers' constitutional rights.,information management.,D,"Information management. The government has many regulations in place that are intended to protect the privacy of customers. Businesses are required by law, therefore, to protect their customers' sensitive information. This is an example of a legal issue associated with information management, not federal government security, customers' constitutional rights, or the company's public relations efforts. Retrieved July 10, 2020, from https://www.smartdatacollective.com/why-consumer-dataprivacy-is-more-important-than-ever/",Information Management,7,hard
"Hardware, software, and databases are all components of ___________ systems.",information,ethics,email,word-of-mouth,A,"Information. An information system is a set of components (including hardware, software, databases, and human resources) that collects, processes, and interprets information. Word-of-mouth is promotion for a business provided by customers who tell others of their satisfaction with the business. Ethics are the basic principles that govern your behavior. This is not an email system. https://www.britannica.com/topic/information-system",Information Management,7,medium
Employees who are working on a project from distant locations can transfer information more efficiently by,sharing documents with file sharing software.,composing and sending detailed email messages.,mailing physical documents to one another.,scheduling meetings in order to work together.,A,"Sharing documents with file sharing software. File sharing enables employees to easily and quickly collaborate with each other and share information. Composing and sending detailed email messages can be time-consuming. Mailing physical documents takes a lot longer and is usually only needed for legal forms that require signatures. Finding time when everyone can work together may be difficult for employees working from distant locations. voice 2020, from https://www.lifewire.com/file-sharing-on-computer-networks-817371",Information Management,7,medium
What is the first step in designing a multi-table query?,Set the correct join direction.,Determine the criteria.,Locate the correct tables.,Pinpoint exactly what you want to know.,D,"Pinpoint exactly what you want to know. In order to create a successful multi-table query, the first step is figuring out exactly what question you want the database to answer. If you aren't exactly sure what you want to know, the database cannot provide you with the information you need. Determining the criteria for the query, locating the correct tables, and setting the correct join direction are all important steps to take before creating the query, but none of them will be successful unless the exact question has been determined first. Retrieved July 10, 2020, from https://www.gcflearnfree.org/access2013/designing-amultitable-query/1/",Information Management,8,easy
A company analyzing data from past holiday sales periods to make decisions concerning release dates for new products is using __________ analytics.,big data,predictive,prescriptive,descriptive,B,"Predictive. Predictive analytics is used to analyze trends in past consumer behavior to predict future behavior. Descriptive analytics is used to condense big data into smaller, more useful pieces of information. Big data analytics refers to analyzing large amounts of data to discover patterns or trends and is not likely to describe specific holiday sales period data. Prescriptive analytics is used to go beyond descriptive and predictive models by recommending one or more courses of action and showing the likely business result of each decision. diagnostic analytics. Retrieved July 10, 2020, from https://www.logianalytics.com/predictiveanalytics/comparing-descriptive-predictive-prescriptive-and-diagnosticanalytics/#:~:text=Descriptive%20Analytics%20tells%20you%20what,take%20to%20affect% 20those%20outcomes.",Information Management,8,medium
Businesses that use computer software to track the customers' billing information and sales transactions create records about their customers',payment history.,financial plans.,income level.,personal preferences.,A,"Payment history. Businesses keep many types of records about their customers. Billing information and sales transactions contain information about the dollar amount owed, sales tax, payment methods, date of payment, etc. Keeping these types of records for extended time frames provides the business with the customer's payment history. Billing information and sales transactions do not always provide specific information about the customers' financial plans, income levels, or personal preferences. 2020, from https://www.helcim.com/article/keep-track-of-customer-data-with-a-crm/",Information Management,8,medium
Which of the following examples illustrates how environmental factors are dynamic:,The government provides subsidies to agricultural businesses.,Demographics influence social and cultural attitudes.,The economy impacts government policies.,High interest rates will eventually get lower.,D,"High interest rates will eventually get lower. Interest rates' fluctuating is an example of how environmental factors are dynamic, or always changing. The influence of factors on each other is an example of how environmental factors are interrelated. The government providing agricultural subsidies is an example of how certain factors impact some industries more than others.",Information Management,8,medium
"Ten customers reviewed a product online. Five of them gave the product five stars, two gave four stars, two gave three stars, and one gave one star. What is the mode value of this data set?",5,4.5,4,3,A,"5. The mode is the most frequently occurring number in a data set. In this example, more customers gave the product five stars versus four, three, two, or one stars, so the mode is five. Four is the mean (average), and 4.5 is the median (middle number). http://www.purplemath.com/modules/meanmode.htm",Information Management,8,hard
Which of the following may happen if a business cuts costs:,It may pay fewer taxes.,It may improve product quality.,It may boost its community involvement.,It may hire more employees.,A,"It may pay fewer taxes. If a business cuts costs, it may pay fewer taxes (if finding tax loopholes is part of the cost-savings plan). This is not always a good thing for the community in which the business operates! When a business cuts costs, it usually sacrifices product quality, spends less time and money in the community, and does not create new jobs.",Operations,8,easy
"So that employees are prepared to act if an accident occurs in the workplace, many businesses provide them with __________ training.",security,fitness,first-aid,fire-response,C,"First-aid. Many businesses provide employees with first-aid training and certification. By knowing what to do if accidents occur in the workplace, employees can help stabilize accident victims until professional medical assistance arrives at the scene. Fire-response training provides employees with knowledge about handling fires in the workplace. Security policies and actions are geared toward preventing robbery and theft in the workplace. Fitness training involves physical exercise. your workplace. Retrieved July 10, 2020, from https://www.firstaidsuppliesonline.com/develop-best-first-aid-program-workplace/",Operations,8,medium
How can a company protect its company name from being imitated by others?,Obtain trademark protection,Place it in the public domain,Apply for a patent,Copyright it,A,Obtain trademark protection. Trademarks protect the unique names of organizations by preventing others from using them. Items placed in the public domain are available for legal use by anyone. Patents are https://www.thebalance.com/intellectual-property-patents-trademarks-1201095,Operations,8,easy
Which of the following is a true statement about a project plan:,It emphasizes flexibility over strategy.,It is not necessary for every project.,It is a road map.,"It is ""set in stone""â€”unchanging.",C,"It is a road map. A project plan is a set of living, related documents that serve as a road map for the project from beginning to end. Every successful project relies on a good project plan. A project plan shows the balance between flexibility and strategy, but it does not emphasize one over the other. A project plan isnâ€™t set in stone; rather, it should be amended as necessary throughout the life of the project.",Operations,8,easy
"When you want to select a new vendor for your business, it's best to",continue using a vendor you've used before.,go with a friend's recommendation.,use a formal selection process.,pick the vendor with the best online reviews.,C,"Use a formal selection process. Selecting a new vendor is a big decision. Depending on what service or product you're buying, you could be investing a lot of money. Using a formal selection process is the smartest and most effective way to make sure you find the vendor that's the best fit for your business. Although you may trust your friend's recommendation, s/he might not share your ideas about what makes a good vendor. It's best to find someone who fits your business's particular needs. Although continuing to use a vendor you've used before isn't necessarily a bad choice, it's still a good idea to find out what other options you have. There might be an even better vendor you just don't know about yet. It's certainly a good sign if a vendor has positive online reviews, but that doesn't mean the vendor will automatically be a good fit for you. Everyone has different needs, and what works for one company might not work for yours. Retrieved July 10, 2020, from http://www.businessknowhow.com/manage/choosevendor.htm",Operations,8,easy
"To maintain a quality work culture throughout all levels of an organization, it is important for businesses to",train employees thoroughly.,solve problems with minimal input.,emphasize short-term gains.,focus primarily on financial issues.,A,"Train employees thoroughly. An important aspect of maintaining a quality work culture is making sure that employees know how to perform their jobs correctly and efficiently. And for employees to perform their jobs to the best of their abilities, businesses need to provide them with thorough training. Businesses often provide ongoing training so that employees are able to keep up with technological changes. Businesses also create and maintain a quality work culture by getting input from internal and external sources to solve problems when needed. Emphasizing short-term gains and focusing primarily on financial issues are barriers to maintaining a quality work culture. 2020, from https://quality.eqms.co.uk/blog/creating-a-culture-of-quality",Operations,9,medium
Which of the following is one of a business's biggest expenses:,Payroll,Insurance,Rent,Utilities,A,"Payroll. Payroll is the money a business pays out for salaries and wages to its employees. It is one of a business's biggest expenses. Therefore, it is important for businesses to get full value for their payroll dollars in order to control expenses. Utilities are part of operating expenses and include heat, water, etc. Insurance is a contractual agreement in which one company will pay for specified losses incurred by the other company in return for installment payments. Rent is money payments for the use of land or property. costs. Retrieved July 10, 2020, from https://www.paycor.com/resource-center/a-closer-lookat-laborcosts#:~:text=HR%20Co%2Downs%20Labor%20Costs,payroll%20or%20other%20related% 20taxes.",Operations,9,easy
Which of the following is a common result of supply chain collaboration:,Customer dissatisfaction,Slower decision-making,Reduced overall costs,Frequent miscommunication,C,"Reduced overall costs. Supply chain collaboration results in increased knowledge sharing among chain members, which can lead to reduced overall costs. Supply chain collaboration can also lead to clearer, more frequent communication among chain members, faster decision-making, and greater customer satisfaction. from http://www.supplytechnologies.com/blog/the-importance-of-supply-chain-collaboration",Operations,9,easy
"Shoshanna wants to become a manager at her office by the end of next year. She writes down what she wants, breaks it down into achievable steps, visualizes herself succeeding, and periodically reviews her progress. Shoshanna is engaging in",objective predicting.,goal setting.,success forecasting.,progress planning.,B,"Goal setting. Goal setting is the ability to visualize, set, and focus on achieving objectives. It's how you determine what it is you want to do. The basic steps of goal setting include choosing your goal, writing your goal down, breaking your goal down, visualizing your goal, and reviewing and updating your goal regularly. Objective predicting, success forecasting, and progress planning are not terms commonly used to describe goal setting.",Professional Development,9,hard
