Question,A,B,C,D,Correct,Explanation,Finance,Assessment,Difficulty
"Protocols, policies, and procedures benefit organizations by keeping employees and customers",patient.,safe.,informed.,competitive.,B,"Safe. Adherence to company policies and procedures keeps employees and customers safe from both internal and external harm. While being informed of protocols, policies, and procedures is important, appropriately following them takes action, not just knowledge. Protocols, policies, and procedures do not necessarily keep employees and customers patient or competitive.",Professional Development,10,medium
"At work, Cory spoke in mocking tones to his supervisor and refused to follow any commands. Cory demonstrated",disorganization.,cordiality.,insubordination.,accountability.,C,"Insubordination. Insubordination is defiance of authority. By speaking in mocking tones to his supervisor and refusing to follow commands, Cory defied authority and acted disrespectfully. Disorganization means having no set order or arrangement. Accountability is accepting responsibility for decisions. Cordiality means being courteous or friendly. Cory did not demonstrate disorganization, accountability, or cordiality.",Professional Development,10,medium
Which of the following is an example of an external ethical issue in risk management:,Safety in the workplace,Compliance with regulation,Misuse of resources,Conflicts of interest,B,"Compliance with regulation. Complying with external regulations and laws is one of the most important functions of risk management. Legal but ethically questionable decisions are risky and can spiral out of control. Safety in the workplace (which involves hazard risk), misuse of resources (one of the main causes of financial risk), and conflicts of interest (situations in which is it impossible to be truly impartial) are examples of internal ethical issues in risk management.",Risk Management,10,medium
"Technology allows companies to facilitate risk management with little or no direct human action, which is an example of",compliance.,automation.,modeling.,statistics.,B,"Automation. Automation is a method of operating or controlling a process in which tasks are completed by automatic means, such as technology, reducing human effort and labor. Technology allows companies to use automation to facilitate risk management with little or no direct human action. Compliance means fulfilling requirements of the law. Modeling means demonstrating or displaying certain behaviors, attitudes, etc., to other people and is a process by which people learn by observing and imitating the behavior of others. Statistics are information presented in numerical form. January 19, 2022, from https://www.forbes.com/sites/forbestechcouncil/2021/02/25/thefuture-of-risk-management-is-automated/?sh=380f88074ed0",Risk Management,10,hard
"Aneeq appreciates how his organization's risk management information system (RMIS) helps him customize the way information is communicated so it is most valuable to the business. In other words, he likes the flexible RMIS __________ tool.",regulation,reporting,reputation,recruitment,B,"Reporting. A risk management information system (RMIS) is a comprehensive technology system used to collect and communicate risk data that impact business decision-making. Businesses use an RMIS for many reasons, including its customizable reporting capabilities, which help organizations communicate data in a valuable way. Customizing business information is not necessarily related to regulation, reputation, or recruitment. Retrieved January 19, 2022, from https://www.ventivtech.com/blog/what-is-an-rmis-riskmanagement-information-system",Risk Management,10,hard
What do risk retention groups and captive insurers have in common?,They are both forms of self-insurance.,They both only write liability coverage.,They can both be headquartered anywhere in the world.,They both require a license in every state in which they operate.,A,"They are both forms of self-insurance. A captive insurer is a form of self-insurance used by a parent company and can include coverage for general liability, workers compensation, terrorism, and more. A risk retention group is a form of self-insurance owned by the members of the group and offers liability insurance. Risk retention groups can only be headquartered in the United States, while captive insurers can be headquartered anywhere in the world. Captive insurers require a state license in every state in which they operate, while risk retention groups can conduct business in multiple states without a license in each one. January 19, 2022, from https://www.caitlin-morgan.com/risk-retention-group-vs-captiveinsurance/",Risk Management,10,easy
Which of the following is considered an external control mechanism impacting how a company functions:,Segregation of duties,Payroll reviewed by leaders,Industry standards,Usernames and passwords,C,"Industry standards. External controls are influences from outside a company that impacts how it functions. They ensure that companies are accountable for their actions and uphold a certain standard of behavior. External control mechanisms include industry standards, government laws and regulations, union contracts, external audits, and media relations. Payroll reviewed by leaders, segregation of duties, and usernames and passwords are all considered to be internal control mechanisms. Internal controls are rules and procedures implemented by a company to manage its operations and create consistent outcomes. Internal controls are used by a company to ensure integrity, prevent fraud, and promote accountability. Retrieved January 19, 2022, from https://www.indeed.com/career-advice/careerdevelopment/external-control",Professional Development,10,easy
"When investing, Canan mixes a variety of asset types and investment vehicles in his portfolio to limit his risk exposure. This is an example of what risk control technique?",Continuity,Duplication,Avoidance,Diversification,D,"Diversification. Diversification is a risk response strategy that involves spreading out your lines of business so that a significant loss in one line will not inordinately impact the others. In the example, Canan spreads out and mixes his portfolio investments so a loss in one area will not excessively impact the others. Duplication is a risk control technique that involves creating a backup plan. Avoidance is a risk response strategy that involves choosing not to do something that is considered risky. Continuity is a fictitious risk control technique. https://www.investopedia.com/terms/r/risk-control.asp",Risk Management,10,hard
Which of the following statements about conducting a variance analysis is true:,It helps management understand current costs and control future costs.,It is often organized by individual rather than by department.,It is necessary to track every single variance.,It is calculated by subtracting actual income from budgeted income.,A,"It helps management understand current costs and control future costs. Variance analysis is a budgetary control tool that evaluates differences between the budgeted and actual financial performance of a company. It acts as a control mechanism, as it allows management to understand current costs and then control future costs. Variance analysis is often organized by department, where management teams can enhance control in a specific area to optimize efficiency. It is not necessary to track all variances. Instead, track a few of the most important variances, depending on the business type, industry profile, and life cycle. The formula for conducting variance analysis is actual income/expense minus budgeted income/expense. January 5, 2022, from https://www.orbacloudcfo.com/how-to-monitor-and-understandbudget-variances/",Financial Analysis,10,medium
"After being fired from his job, Jack wrote blog posts in which he criticized his former company and all of its employees. He made many negative comments, most of which were untrue. What tort is Jack committing?",Defamation,Invasion of privacy,Battery,Negligence,A,"Defamation. Defamation is the publication of an untrue statement that subjects an entity to ridicule or contempt. Jack is publishing untrue information about his former employer out of spite, so he is committing defamation. Invasion of privacy occurs when a person's personal life is exposed unnecessarily. Battery is intentionally touching another in a harmful or offensive way without justification. Negligence includes situations in which harm is caused accidentally. None of these three types of torts apply to Jack. Cengage Learning, Inc.",Business Law,1,hard
An important purpose of regulations in the finance industry is to,prevent the banking system from failing.,limit the amount of money individuals can earn.,challenge the integrity of the financial system.,ensure companies are held accountable for product safety.,A,"Prevent the banking system from failing. Regulations require safeguards that help ensure that the banking system does not collapse. Regulations aim to prevent and offset the negative effects of bank failures. Regulations in the financial industry do not aim to limit the amount of money that individuals can earn. Financial regulations help reinforce the integrity of the financial system rather than challenging it. Financial regulations do not necessarily relate to product safety. services organizations: Benefits of a holistic approach. Retrieved August 6, 2021, from https://www.metricstream.com/whitepapers/html/financial_services.htm",Business Law,1,easy
One benefit of using technology in compliance is that technology is typically more __________ than maintaining manual compliance processes.,costly,efficient,time-consuming,error prone,B,"Efficient. Technology can make compliance processes more efficient and effective. Manual compliance processes can be more costly, more time-consuming, and more error prone. help modernize compliance. Retrieved August 6, 2021, from https://deloitte.wsj.com/articles/technology-a-powerful-tool-to-help-modernize-compliance1543802532",Business Law,1,hard
What are import quotas and tariffs designed to do?,Eliminate the movement of illegal merchandise,Prevent harmful substances from entering a country,Prevent illegal immigration across national borders,Protect a country's economy from foreign competition,D,"Protect a country's economy from foreign competition. By imposing tariffs or quotas on commodities entering a country, the country can reduce the economic impact of imported products. Quotas and tariffs do not prevent harmful substances or illegal merchandise from entering a country. Quotas and tariffs do not have an impact on illegal immigration. https://www.economicsonline.co.uk/Global_economics/Tariffs_and_quotas.html",Business Law,1,easy
Which of the following is a characteristic of the illegal practice of affinity fraud:,Primarily involves buying and selling commodities,Targets identifiable groups of people,Fails to offer testimonials during sales pitches,Pays a minimal dividend to encourage additional investment,B,"Targets identifiable groups of people. Affinity fraud often takes the form of a Ponzi or pyramid scheme and involves targeting members who belong to the same group such as a church, senior citizen's social club, or civic organization. Because the scammer claims an association with the group and often lures group leaders or respected group members into investing in the scheme, other group members may believe that they can trust the scammer, which prompts them to hand over their money for ""investment."" The leaders or respected group members who fall prey to the scheme may provide testimonials to encourage investment. Group members who invest later in the scam often do not see any return on their investment. Affinity fraud does not primarily involve buying and selling commodities. swindlers who claim loyalty to your group. Retrieved August 6, 2021, from https://www.nasaa.org/7157/affinity-fraud-beware-of-swindlers-who-claim-loyalty-to-yourgroup/",Business Law,1,easy
Which of the following actions would be considered illegal insider trading:,Gaining access to competitors' data,Discussing how a new CEO will affect the company's stock prices with a coworker,Buying the stock of your own company,Selling a company's stock after an employee tells you about its upcoming merger before that knowledge is public,D,"Selling a company's stock after an employee tells you about its upcoming merger before that knowledge is public. Insider trading is buying or selling a security while in possession of material, nonpublic information. If a company's employee tells you that it is about to undergo a merger before that knowledge is public, and you sell the company's stock in response, you are participating in illegal insider trading. Internally discussing changes in the business (and their effects on stock prices) internally is not illegal insider trading. Buying the stock of your own company is not illegal insider trading. Finally, gaining access to competitors' data is not illegal insider trading. from https://www.sec.gov/fast-answers/answersinsiderhtm.html",Business Law,1,easy
Which of the following is a tax-deductible expense:,A computer for a home-based business,Personal phone charges,Athletic-club membership fees,International leisure travel,A,"A computer for a home-based business. Many business expensesâ€”equipment, supplies, and travelâ€”are tax deductible under specific conditions. Often, individuals pay for business-related goods and services up front and list them as deductions on their tax returns, which can lower their tax obligation. A computer used for a home-based business is an example of an item that can be claimed as a tax deduction on a tax return. Goods and services for personal consumptionâ€”personal phone charges, athletic-club membership fees, and international leisure travelâ€”are not tax-deductible expenses. https://corporatefinanceinstitute.com/resources/knowledge/finance/tax-deductible/",Business Law,1,medium
"Aiden is doing research for a school project. While searching the internet, he finds an article that he thinks may be helpful for his project. Which of the following would indicate that the author of the article is most likely a credible source:",The author has included their personal Twitter handle.,There is no background information provided about the author.,The author lists their professional background and qualifications.,The author is currently a student in college.,C,"The author lists their professional background and qualifications. Credible authors generally provide background information about themselves such as where they attended school or received training. If there is no background information provided by an author, it is best to do further research on the individual to determine if they are a credible source of information. Including a personal Twitter handle does not necessarily imply credibility. Articles and reports by college students may be useful in certain situations but usually should not be used as primary sources of information, because their credibility cannot be guaranteed. 2021, from https://guides.library.jhu.edu/evaluate/sources",Communication Skills,1,hard
"Cynthia and Gerald are proposing a new project to their boss. When the boss questions Gerald about something he says, what should Gerald do?",Explain to the boss that Cynthia wrote their project proposal,Ask for clarity on the question and make sure he answers it fully,Answer a different question that Gerald definitely knows the answer to,Act defensive because the boss doesn't understand the project,B,"Ask for clarity on the question and make sure he answers it fully. By asking for clarity, Gerald can make sure that he fully understands his boss's question and give him the best possible answer. Telling the boss that Cynthia wrote the project, answering a different question, or acting defensively would reflect poorly on Gerald and paint him in a bad light. Retrieved August 6, 2021, from https://www.indeed.com/career-advice/careerdevelopment/clarifying-questions",Communication Skills,1,medium
You're giving a presentation at your job about the company's sales figures. You want to show how much profit the company has made in each of the past 12 months. Which visual aid should you choose to show this?,A photograph,A pie chart,A line graph,A video,C,"A line graph. Line graphs are best used to show changes (particularly small changes) over time. For example, if you want to demonstrate your company's profit in each of the past 12 months, a line graph would be one effective method. Pie charts are more commonly used to show how categories relate to the whole. A photograph or a video would likely not showcase the data you want to present. your data. Retrieved August 6, 2021, from https://blog.hubspot.com/marketing/types-ofgraphs-for-data-visualization",Communication Skills,1,hard
"In addition to his name, address, and phone number, what information should Dwight include in his corporate email signature?","His position, work history, and email address","His work history, company, and email address","His position, company, and email address","His position, company, and references",C,"His position, company, and email address. An email signature is generally text or images appearing at the bottom of an email indicating a person's or business's identity, contact information, and/or offer. A business professional's email signature should containâ€”at the very leastâ€”the person's name, address, phone number, position, company, and email address. It is not necessary or recommended to include your work history or references in your email signature. Retrieved August 6, 2021, from https://blog.hubspot.com/marketing/professional-emailsignatures",Communication Skills,2,easy
Who is responsible for approving corporate governance goals and policies?,Shareholders,Chief executive officer,Board of directors,Management team,C,"Board of directors. The board of directors approves high-level corporate governance goals and policies. The chief executive officer and management team are responsible for recommending the goals and policies to be approved by the board. Select shareholders may be on the board of directors, but the shareholders as a whole do not approve goals and policies. functions https://www.investopedia.com/terms/c/corporategovernance.asp",Professional Development,2,medium
Which of the following is a result of building and maintaining relationships with customers:,Increased loyalty,Fewer brand advocates,Decreased satisfaction,Customer turnover,A,"Increased loyalty. Customers are more likely to remain loyal to companies that actively maintain relationships with them because customers enjoy feeling appreciated and respected. For this reason, customers that have relationships with companies tend to be valuable brand advocates to their friends and families. Building and maintaining relationships with customers usually results in increased customer satisfaction, not decreased satisfaction. Customer turnover is unlikely when relationships with customers are maintained. Retrieved August 6, 2021, from https://fjrgroup.com/insights/the-benefits-of-buildinglongterm-business-relationships/",Customer Relations,2,medium
Are customers who do not complain a more difficult problem for businesses than customers who do complain?,"No, because the salesperson can satisfy the customers who do not complain within company guidelines.","Yes, because records of the complaints cannot be maintained.","No, because customers who do not complain do not express ill feelings.","Yes, because the salesperson does not have an opportunity to handle the complaint.",D,"Yes, because the salesperson does not have an opportunity to handle the complaint. Salespeople are not able to satisfy customers who do not complain, because they do not express their dissatisfaction to anyone associated with the business. They do, however, express ill feelings to friends, to relatives, and to coworkers. In this way, they create a poor image of the business. Because of this, they are a much bigger problem than complainers. Once salespeople know the source of customer complaints, they can seek ways to satisfy the complainers within company guidelines. complain. Retrieved August 6, 2021, from https://www.providesupport.com/blog/5-reasonsunhappy-customers-dont-complain/",Customer Relations,2,easy
A primary factor that has led to the consolidation of financial firms is the desire,to lower costs.,for fewer assets.,for fewer products.,to lower risks.,A,"To lower costs. Consolidation is the merging of financial providers within the same institutional category. For example, consolidation occurs when two banks merge to form one bank. By consolidating, the financial firms can achieve economies of scale, which result in reduced redundancy and lower costs. Consolidation can increase the assets (liquid capital) for all of the financial firms involved. Consolidation can also provide consumers with a wider range of financial products. Consolidation may or may not lower business risk. 2021, from https://pocketsense.com/the-advantages-of-bank-mergers-13657465.html",Financial Analysis,2,medium
"When discussing your personal finances with a financial advisor, it's important to",be open and transparent.,exaggerate your income.,keep certain debts secret.,be guarded and skeptical.,A,"Be open and transparent. When discussing your personal finances with a financial advisor, it's important to be open and transparent so that the advisor can best meet your needs. If you lie about your debts, exaggerate your income, or keep certain aspects of your finances secret, the financial advisor will not be able to help you to the best of their ability. advisor. Retrieved August 6, 2021, from https://www.wiseradvisor.com/blog/financial-advisorguide/need-for-honest-conversation-with-your-financial-advisor/",Customer Relations,2,medium
"While filing a homeowner's insurance claim, Mrs. Ramirez was accidentally disconnected from the call center representative who was helping her. When Mrs. Ramirez called back, she didn't know whom to ask for, because she couldn't remember the name of the representative who had been assisting her. What type of Customer Relationship Management (CRM) data would be most helpful in identifying the representative?",Self-provided data,Demographic data,Interaction data,Historical data,C,"Interaction data. Customer Relationship Management (CRM) data warehouses typically contain several types of data. Interaction data contain details regarding written and/or phone solicitations made to a customer, visits that the customer made to the business, and instances when the customer contacted the call center for assistance. Demographic data include gender, age, race, ethnicity, income level, and other basic customer information. Self-provided data are pieces of information that the customer has voluntarily shared with the business. Historical data include old sets of data reviewed and used for new purposes. interaction data. Retrieved August 6, 2021, from https://www.inetco.com/blog/2015/08/whatis-customer-analytics-part-2-sourcing-customer-interaction-data/",Customer Relations,2,hard
Environmental degradation occurs because of,nationalism.,offshoring.,increased production.,decreased competition.,C,"Increased production. Environmental degradation occurs because of increased production. The more goods that are being produced, the greater the chances are for pollution and loss of natural resources. Offshoring is the practice of moving domestic jobs overseas. Nationalism is a sense of pride in one's own country. Globalization causes increased competition, which leads to greater production and more environmental degradation.",Economics,2,medium
"Nadia's assistant, Roger, rarely does what he's supposed to do. He routinely forgets to schedule her appointments, orders the wrong supplies for her office, and misses work at least a few times a month. An employee like Roger is an example of a(n) __________ risk.",hazard,operational,strategic,financial,B,"Operational. Operational risks are the possible events and situations that can result from employee actions, core processes, and daily business activities. Unfortunately, people and processes aren't perfectâ€”as long as a business deals with people, it will always have some degree of operational risk. Take Nadia's employee Roger, for example, whose human errors are considered operational risks. Hazard risks are potential events or situations that can cause injury or harm to people, property, or the environment. Most hazard risks can only cause business losses, not gains. Strategic risks are broad risks that often concern the overall business environment. Financial risks are possible events or situations that directly influence a company's cash flow.",Economics,2,hard
"If the economy is sluggish, what might a central bank do to encourage spending and investing?",Lower interest rates,Double interest rates,Eliminate interest rates,Disregard interest rates,A,"Lower interest rates. If the economy is sluggish, a central bank may lower interest rates in hopes of encouraging spending and investing. In this situation, interest rates would not be doubled. Interest rates are an important part of an economy and would not be eliminated or disregarded. Retrieved August 6, 2021, from https://www.investopedia.com/ask/answers/101315/dolower-interest-rates-increase-investment-spending.asp",Economics,2,easy
